{
  "schemaVersion": "1.0.0",
  "preflightCheckId": "preflight-frontend-boundary-review",
  "planId": "ready-plan-deploy-frontend-review",
  "stepId": "ready-step-frontend-boundary-review",
  "checkType": "boundary",
  "status": "pass",
  "severity": "info",
  "reason": "Future deployment review remains modeled only and cannot trigger deployment.",
  "checkedAt": "2026-06-05T18:01:00Z",
  "evidence": [
    "Phase 9 execution boundary flags remain false.",
    "Phase 10 readiness boundary flags remain false."
  ]
}
